Soru,Cevap
Üniversitenin akademik personellerinin yaşları hakkında bilgi verir misin ?,"Üniversitemizde 25 yaşından küçük olan 12 akademisyen, 26-30 yaşları arasında 339 akademisyen, 31-35 yaşları arasında 491 akademisyen, 36-40 yaşları arasında 379 akademisyen, 41-50 yaşları arasında 617 akademisyen ve 51 yaşının üzerinde olan 659 akademisyen bulunmaktadır."
Mühendislik fakültesinde kaç adet profesör var ?,Mühendislik Fakültesinde 42 profesör bulunmaktadır.
Mühendislik fakültesinde kaç tane akademik personel var ?,Mühendislik Fakültesinde toplam 157 akademik personel bulunmaktadır.
En çok profesörün olduğu bölüm ve fakülte hangileridir ?,Üniversitemizde en çok profesör bulunduran fakülte 170 profesörle Tıp fakültesidir. Dahili Tıp Bilimleri Bölümü ise en çok profesör bulunduran bölümdür. Bu bölümde 87 profesör bulunmaktadır.
Bilgisayar Mühendisliği bölümünde kaç profesör bulunmaktadır?,Bilgisayar Mühendisliği fakültesinde 1 profesör bulunmaktadır.
Akademik Personelin Yabancı Dil İstatistikleri hakkında bilgi verir misin ?,"Üniversitemizde İngilizce yabancı dili bulunan 2059 akademisyen, Almanca dili bulunan 77 akademisyen, Fransızca dili bulunan 45 akademisyen, Arapça dili bulunan 42 akademisyen, Rusça dili bulunan 12 akademisyen, Farsça dili bulunan 6 akademisyen, İspanyolca dili bulunan 4 akademisyen ve İtalyanca dili bulunan 3 akademisyen vardır."
Akademik Personelin Cinsiyet İstatistikleri hakkında bilgi verir misin ?,"Üniversitemizde Toplam 1120 kadın adakemisyen ve 1377 erkek akademisyen bulunmaktadır. Bu verileri oranlarsak üniversitemizde %45 oranında kadın akademisyen, %55 oranında erkek akademisyen bulunmaktadır."
Üniversitedeki profesörlerin cinsiyet istatistikleri hakkında bilgi verir misin?,"Üniversitemizde Toplam 154 kadın profesör ve 406 erkek profesör bulunmaktadır. Bu verileri oranlarsak üniversitemizde %28 oranında kadın profesör, %72 oranında erkek profesör bulunmaktadır."
Üniversite öğrencilerinin cinsiyet istatistiklerini verir misin ?,"Üniversitemizde Toplam 13886 kız lisans öğrencisi ve 13327 erkek lisans öğrencisi bulunmaktadır. Bu verileri oranlarsak üniversitemizde %51 oranında kız öğrenci, %49 oranında erkek öğrenci bulunmaktadır."
Mühendislik fakültesinde kaç öğrenci var ?,Mühendislik Fakültesinde lisans seviyesinde 3192 öğrenci bulunmaktadır.
Bilgisayar mühendisliği bölümünde kaç adet öğrenci bulunuyor ?,Bilgisayar Mühendisliği Bölümünde lisans seviyesinde 519 öğrenci bulunmaktadır.
Bilgisayar mühendisliği bölümünde kaç adet laboratuvar bulunmaktadır ?,Bilgisayar Mühendisliği bölümünün internet sitesinden alınan bilgilere göre bölümde 11 adet laboratuvar bulunmaktadır.
Bilgisayar mühendisliği için ders programını nereden bulabilirim ?,Bilgisayar Mühendisliği bölümünün ders programını https://bil-muhendislik.omu.edu.tr/tr/egitim/ders-programlari adresinde bulabilirsiniz.
Bilgisayar mühendisliği öğretim üyeleri kimlerdir ?,https://bil-muhendislik.omu.edu.tr/tr/personel/ogretim-uyeleri Adresinden bilgisayar mühendisliği öğretim üyelerini ve uzmanlık alanlarını inceleyebilirsiniz.
